{"appearancePolicy":{"hazardColor":"#F94144","hazardMaterial":"Neon","material":"SmoothPlastic","paletteIntent":"sky-high-contrast","policyId":"g1c-native-high-contrast-v1","primaryColor":"#4CC9F0","rewardColor":"#F9C74F","secondaryColor":"#4895EF","sourceVisualStyleIntentId":"visual-global"},"budgets":{"maxDecorativeZones":128,"maxGameplayObjects":501,"maxOutputBytes":4194304,"maxPartSize":256,"maxStages":50,"maxWorldExtent":2048},"characterPlacement":{"orientationPolicy":"face-next-safe-route-object","strategy":"humanoid-root-part-cframe-v1","verticalOffset":3},"checkpointPlan":{"checkpointObjectIds":["Checkpoint001","Checkpoint002"],"mode":"ordered"},"coordinateSystem":{"forwardAxis":"-Z","handedness":"right-handed","rotationOrder":"XYZ","rotationUnit":"degrees","units":"studs","upAxis":"+Y"},"decorativeZones":[{"bounds":{"maximum":{"x":4,"y":13,"z":-4},"minimum":{"x":-4,"y":1,"z":-12}},"collisionPolicy":"non-colliding-only","nativePartFallback":true,"sourceAssetIntentIds":["asset-decoration"],"sourceStageId":"stage-01","sourceVisualStyleIntentId":"visual-global","zoneId":"layout-zone-001"},{"bounds":{"maximum":{"x":20,"y":13,"z":-4},"minimum":{"x":12,"y":1,"z":-12}},"collisionPolicy":"non-colliding-only","nativePartFallback":true,"sourceAssetIntentIds":["asset-decoration"],"sourceStageId":"stage-02","sourceVisualStyleIntentId":"visual-global","zoneId":"layout-zone-002"},{"bounds":{"maximum":{"x":36,"y":13,"z":-4},"minimum":{"x":28,"y":1,"z":-12}},"collisionPolicy":"non-colliding-only","nativePartFallback":true,"sourceAssetIntentIds":["asset-decoration"],"sourceStageId":"stage-03","sourceVisualStyleIntentId":"visual-global","zoneId":"layout-zone-003"},{"bounds":{"maximum":{"x":52,"y":13,"z":-4},"minimum":{"x":44,"y":1,"z":-12}},"collisionPolicy":"non-colliding-only","nativePartFallback":true,"sourceAssetIntentIds":["asset-decoration"],"sourceStageId":"stage-04","sourceVisualStyleIntentId":"visual-global","zoneId":"layout-zone-004"},{"bounds":{"maximum":{"x":68,"y":13,"z":-4},"minimum":{"x":60,"y":1,"z":-12}},"collisionPolicy":"non-colliding-only","nativePartFallback":true,"sourceAssetIntentIds":["asset-decoration"],"sourceStageId":"stage-05","sourceVisualStyleIntentId":"visual-global","zoneId":"layout-zone-005"},{"bounds":{"maximum":{"x":84,"y":13,"z":12},"minimum":{"x":76,"y":1,"z":4}},"collisionPolicy":"non-colliding-only","nativePartFallback":true,"sourceAssetIntentIds":["asset-decoration"],"sourceStageId":"stage-06","sourceVisualStyleIntentId":"visual-global","zoneId":"layout-zone-006"},{"bounds":{"maximum":{"x":100,"y":13,"z":-4},"minimum":{"x":92,"y":1,"z":-12}},"collisionPolicy":"non-colliding-only","nativePartFallback":true,"sourceAssetIntentIds":["asset-decoration"],"sourceStageId":"stage-07","sourceVisualStyleIntentId":"visual-global","zoneId":"layout-zone-007"},{"bounds":{"maximum":{"x":124,"y":13,"z":4},"minimum":{"x":116,"y":1,"z":-4}},"collisionPolicy":"non-colliding-only","nativePartFallback":true,"sourceAssetIntentIds":["asset-decoration"],"sourceStageId":"stage-08","sourceVisualStyleIntentId":"visual-global","zoneId":"layout-zone-008"},{"bounds":{"maximum":{"x":116,"y":13,"z":28},"minimum":{"x":108,"y":1,"z":20}},"collisionPolicy":"non-colliding-only","nativePartFallback":true,"sourceAssetIntentIds":["asset-decoration"],"sourceStageId":"stage-09","sourceVisualStyleIntentId":"visual-global","zoneId":"layout-zone-009"},{"bounds":{"maximum":{"x":100,"y":13,"z":12},"minimum":{"x":92,"y":1,"z":4}},"collisionPolicy":"non-colliding-only","nativePartFallback":true,"sourceAssetIntentIds":["asset-decoration"],"sourceStageId":"stage-10","sourceVisualStyleIntentId":"visual-global","zoneId":"layout-zone-010"},{"bounds":{"maximum":{"x":84,"y":13,"z":12},"minimum":{"x":76,"y":1,"z":4}},"collisionPolicy":"non-colliding-only","nativePartFallback":true,"sourceAssetIntentIds":["asset-decoration"],"sourceStageId":"stage-11","sourceVisualStyleIntentId":"visual-global","zoneId":"layout-zone-011"},{"bounds":{"maximum":{"x":68,"y":13,"z":12},"minimum":{"x":60,"y":1,"z":4}},"collisionPolicy":"non-colliding-only","nativePartFallback":true,"sourceAssetIntentIds":["asset-decoration"],"sourceStageId":"stage-12","sourceVisualStyleIntentId":"visual-global","zoneId":"layout-zone-012"},{"bounds":{"maximum":{"x":52,"y":13,"z":28},"minimum":{"x":44,"y":1,"z":20}},"collisionPolicy":"non-colliding-only","nativePartFallback":true,"sourceAssetIntentIds":["asset-decoration"],"sourceStageId":"stage-13","sourceVisualStyleIntentId":"visual-global","zoneId":"layout-zone-013"},{"bounds":{"maximum":{"x":36,"y":13,"z":12},"minimum":{"x":28,"y":1,"z":4}},"collisionPolicy":"non-colliding-only","nativePartFallback":true,"sourceAssetIntentIds":["asset-decoration"],"sourceStageId":"stage-14","sourceVisualStyleIntentId":"visual-global","zoneId":"layout-zone-014"},{"bounds":{"maximum":{"x":20,"y":13,"z":28},"minimum":{"x":12,"y":1,"z":20}},"collisionPolicy":"non-colliding-only","nativePartFallback":true,"sourceAssetIntentIds":["asset-decoration"],"sourceStageId":"stage-15","sourceVisualStyleIntentId":"visual-global","zoneId":"layout-zone-015"}],"findings":[{"code":"model-relative-reachability","message":"Every required transition is feasible under the configured deterministic coarse model; this is not exact Roblox physics.","relatedSourceIds":["required-safe-route"],"severity":"information"},{"code":"native-fallback-selected","message":"Decorative zones retain deterministic non-colliding native-Part fallback authority.","relatedSourceIds":["asset-decoration"],"severity":"information"},{"code":"route-row-wrapped","message":"The bounded serpentine route advanced to one or more additional rows.","relatedSourceIds":["required-safe-route"],"severity":"information"}],"finishCriteria":{"finishObjectId":"Finish","type":"touch-finish"},"genre":"obby","limitations":[],"name":"Deterministic Native Part Layout","objects":[{"appearance":{"color":"#4CC9F0","colorRole":"primary","material":"SmoothPlastic"},"authority":"native-gameplay","collision":{"anchored":true,"canCollide":true,"canQuery":true,"canTouch":false},"geometry":{"axisAlignedBounds":{"maximum":{"x":-10,"y":2,"z":6},"minimum":{"x":-22,"y":0,"z":-6}},"methodId":"geometry-evaluator-v0.1","normalizedGeometryHash":"sha256:54a335a320c68cd334fd05528936c689ca97d08ec9b5db9747954c5cc481984b","surfaceKind":"planar-face","topSurfaceMaximumY":2},"id":"Spawn","order":0,"role":"spawn","shape":"Block","size":{"x":12,"y":2,"z":12},"sourceReferences":{"sourceAssetIntentIds":["asset-gameplay-route"]},"transform":{"position":{"x":-16,"y":1,"z":0},"rotation":{"x":0,"y":-90,"z":0}}},{"appearance":{"color":"#4895EF","colorRole":"secondary","material":"SmoothPlastic"},"authority":"native-gameplay","collision":{"anchored":true,"canCollide":true,"canQuery":true,"canTouch":false},"geometry":{"axisAlignedBounds":{"maximum":{"x":0,"y":2,"z":4},"minimum":{"x":-8,"y":0,"z":-4}},"methodId":"geometry-evaluator-v0.1","normalizedGeometryHash":"sha256:d9b25c75819c0325ff5a5f85df6ad0b3aa42bf87edcf74cf26551e7692ff6bc0","surfaceKind":"planar-face","topSurfaceMaximumY":2},"id":"Stage01Route001","order":1,"role":"platform","shape":"Block","size":{"x":8,"y":2,"z":8},"sourceReferences":{"sourceAssetIntentIds":["asset-decoration","asset-gameplay-route"],"sourceMechanicIntentId":"mechanic-intent-01","sourceStageId":"stage-01"},"transform":{"position":{"x":-4,"y":1,"z":0},"rotation":{"x":0,"y":-90,"z":0}}},{"appearance":{"color":"#4CC9F0","colorRole":"primary","material":"SmoothPlastic"},"authority":"native-gameplay","collision":{"anchored":true,"canCollide":true,"canQuery":true,"canTouch":false},"geometry":{"axisAlignedBounds":{"maximum":{"x":4,"y":2,"z":4},"minimum":{"x":-4,"y":0,"z":-4}},"methodId":"geometry-evaluator-v0.1","normalizedGeometryHash":"sha256:6957f729f4cd7b0b79a2cd180abe5719d67dcd5f6c1fd292c3df275c03c28516","surfaceKind":"planar-face","topSurfaceMaximumY":2},"id":"Stage01Route002","order":2,"role":"platform","shape":"Block","size":{"x":8,"y":2,"z":8},"sourceReferences":{"sourceAssetIntentIds":["asset-decoration","asset-gameplay-route"],"sourceMechanicIntentId":"mechanic-intent-01","sourceStageId":"stage-01"},"transform":{"position":{"x":0,"y":1,"z":0},"rotation":{"x":0,"y":-90,"z":0}}},{"appearance":{"color":"#4895EF","colorRole":"secondary","material":"SmoothPlastic"},"authority":"native-gameplay","collision":{"anchored":true,"canCollide":true,"canQuery":true,"canTouch":false},"geometry":{"axisAlignedBounds":{"maximum":{"x":8,"y":2,"z":4},"minimum":{"x":0,"y":0,"z":-4}},"methodId":"geometry-evaluator-v0.1","normalizedGeometryHash":"sha256:667d581f7e3cd9ba282ad5f0c01924e03d9ff1e5b7db9c1af583f68c6aa3ccec","surfaceKind":"planar-face","topSurfaceMaximumY":2},"id":"Stage01Route003","order":3,"role":"platform","shape":"Block","size":{"x":8,"y":2,"z":8},"sourceReferences":{"sourceAssetIntentIds":["asset-decoration","asset-gameplay-route"],"sourceMechanicIntentId":"mechanic-intent-01","sourceStageId":"stage-01"},"transform":{"position":{"x":4,"y":1,"z":0},"rotation":{"x":0,"y":-90,"z":0}}},{"appearance":{"color":"#4CC9F0","colorRole":"primary","material":"SmoothPlastic"},"authority":"native-gameplay","collision":{"anchored":true,"canCollide":true,"canQuery":true,"canTouch":false},"geometry":{"axisAlignedBounds":{"maximum":{"x":16,"y":2,"z":4},"minimum":{"x":8,"y":0,"z":-4}},"methodId":"geometry-evaluator-v0.1","normalizedGeometryHash":"sha256:c3db48069365516e39aa7403efd608534fbc011a96a9d357dcf2698d1b45960f","surfaceKind":"planar-face","topSurfaceMaximumY":2},"id":"Stage02Route001","order":4,"role":"platform","shape":"Block","size":{"x":8,"y":2,"z":8},"sourceReferences":{"sourceAssetIntentIds":["asset-decoration","asset-gameplay-route"],"sourceMechanicIntentId":"mechanic-intent-02","sourceStageId":"stage-02"},"transform":{"position":{"x":12,"y":1,"z":0},"rotation":{"x":0,"y":-90,"z":0}}},{"appearance":{"color":"#4895EF","colorRole":"secondary","material":"SmoothPlastic"},"authority":"native-gameplay","collision":{"anchored":true,"